{
  "version": "2026.09.2",
  "date": null,
  "changes": {
    "new": [
      "Клиенты могут выбрать постоянное уникальное игровое имя при первом входе в портал.",
      "Администраторы могут управлять словарями, из которых создаются игровые имена клиентов."
    ],
    "improved": [
      "В клиентский портал теперь можно войти по постоянной личной ссылке без PIN-кода."
    ],
    "fixed": [],
    "security": []
  },
  "codename": "Dolce"
}
