{
  "version": "2026.07.1",
  "codename": "Accordatura",
  "codenameMeaning": "Настройка музыкального инструмента.",
  "date": "2026-07-29",
  "changes": {
    "new": [
      "Черновики форм теперь сохраняются автоматически и восстанавливаются после перезагрузки страницы.",
      "Номер версии и история обновлений теперь доступны в приложении."
    ],
    "improved": [
      "Обновлено интерактивное знакомство с приложением с учетом роли пользователя.",
      "Работа с формами, таблицами, списками и календарем на телефонах стала удобнее.",
      "Страницы открываются быстрее, а состояния загрузки, ошибок и пустых списков стали понятнее.",
      "Навигация, фильтры и выбранные вкладки лучше сохраняют контекст работы."
    ],
    "fixed": [
      "Повторяющиеся занятия снова корректно появляются в подписочных календарях.",
      "Исправлены сбои при заполнении пользовательских задач и других сохраняемых форм.",
      "Экранная клавиатура больше не перекрывает выбор значений и даты в мобильных формах."
    ],
    "security": [
      "Усилена защита учетных записей, активных сеансов и ссылок с доступом к данным."
    ]
  }
}
