{
  "version": "2026.08.1",
  "codename": "Cantabile",
  "date": "2026-08-02",
  "changes": {
    "new": [
      "Добавление многопользовательского режима в клиентский портал."
    ],
    "improved": [
      "Статистика точнее отражает выручку, загрузку и активность клиентов; пояснения к показателям стали понятнее.",
      "В клиентском портале показывается ближайшее актуальное занятие, включая уже начавшееся.",
      "Подписочные календари содержат всю прошедшую историю и занятия на ближайшие 14 дней."
    ],
    "fixed": [
      "Клиенты, у которых прошли платные занятия после консультации, больше не остаются в статусе «Думающий лид»."
    ],
    "security": []
  }
}
