{
  "version": "2026.09.1",
  "codename": "Cantabile",
  "codenameMeaning": "Певучее, напевное исполнение.",
  "date": "2026-09-04",
  "changes": {
    "new": [
      "\u0414\u043E\u0431\u0430\u0432\u043B\u0435\u043D\u0438\u0435 \u043C\u043D\u043E\u0433\u043E\u043F\u043E\u043B\u044C\u0437\u043E\u0432\u0430\u0442\u0435\u043B\u044C\u0441\u043A\u043E\u0433\u043E \u0440\u0435\u0436\u0438\u043C\u0430 \u0432 \u043A\u043B\u0438\u0435\u043D\u0442\u0441\u043A\u0438\u0439 \u043F\u043E\u0440\u0442\u0430\u043B.",
      "\u0412 \u043F\u0440\u0438\u043B\u043E\u0436\u0435\u043D\u0438\u0438 \u043F\u043E\u044F\u0432\u0438\u043B\u0441\u044F \u0446\u0435\u043D\u0442\u0440 \u0443\u0432\u0435\u0434\u043E\u043C\u043B\u0435\u043D\u0438\u0439 \u0441 \u0438\u0441\u0442\u043E\u0440\u0438\u0435\u0439, \u043E\u0442\u043C\u0435\u0442\u043A\u0430\u043C\u0438 \u043E \u043F\u0440\u043E\u0447\u0442\u0435\u043D\u0438\u0438 \u0438 \u043F\u043E\u0434\u0434\u0435\u0440\u0436\u043A\u043E\u0439 push-\u0443\u0432\u0435\u0434\u043E\u043C\u043B\u0435\u043D\u0438\u0439.",
      "\u041F\u0440\u0435\u043F\u043E\u0434\u0430\u0432\u0430\u0442\u0435\u043B\u0438 \u0438 \u0430\u0434\u043C\u0438\u043D\u0438\u0441\u0442\u0440\u0430\u0442\u043E\u0440\u044B \u043C\u043E\u0433\u0443\u0442 \u043E\u0442\u043F\u0440\u0430\u0432\u043B\u044F\u0442\u044C \u043D\u0430 \u0441\u043E\u0433\u043B\u0430\u0441\u043E\u0432\u0430\u043D\u0438\u0435 \u043E\u0442\u043F\u0443\u0441\u043A\u0430 \u0438 \u0438\u0437\u043C\u0435\u043D\u0435\u043D\u0438\u044F \u0440\u0430\u0431\u043E\u0447\u0435\u0433\u043E \u0440\u0430\u0441\u043F\u0438\u0441\u0430\u043D\u0438\u044F, \u0430 \u043A\u043B\u0438\u0435\u043D\u0442\u044B \u2014 \u0437\u0430\u044F\u0432\u043A\u0438 \u043D\u0430 \u043E\u0442\u043F\u0443\u0441\u043A \u0447\u0435\u0440\u0435\u0437 \u043B\u0438\u0447\u043D\u044B\u0439 \u043A\u0430\u0431\u0438\u043D\u0435\u0442.",
      "\u0421\u0443\u043F\u0435\u0440\u043F\u043E\u043B\u044C\u0437\u043E\u0432\u0430\u0442\u0435\u043B\u0438 \u043F\u043E\u043B\u0443\u0447\u0438\u043B\u0438 \u043E\u0447\u0435\u0440\u0435\u0434\u044C \u0434\u043B\u044F \u0440\u0430\u0441\u0441\u043C\u043E\u0442\u0440\u0435\u043D\u0438\u044F \u0437\u0430\u044F\u0432\u043E\u043A \u043D\u0430 \u043E\u0442\u043F\u0443\u0441\u043A\u0430 \u0438 \u0438\u0437\u043C\u0435\u043D\u0435\u043D\u0438\u044F \u0440\u0430\u0431\u043E\u0447\u0435\u0433\u043E \u0440\u0430\u0441\u043F\u0438\u0441\u0430\u043D\u0438\u044F.",
      "\u0414\u043E\u0431\u0430\u0432\u043B\u0435\u043D\u044B \u0441\u0438\u0441\u0442\u0435\u043C\u043D\u044B\u0435 \u043E\u0431\u044A\u044F\u0432\u043B\u0435\u043D\u0438\u044F \u0434\u043B\u044F \u0441\u043E\u0442\u0440\u0443\u0434\u043D\u0438\u043A\u043E\u0432 \u0438 \u043A\u043B\u0438\u0435\u043D\u0442\u043E\u0432."
    ],
    "improved": [
      "\u0421\u0442\u0430\u0442\u0438\u0441\u0442\u0438\u043A\u0430 \u0442\u043E\u0447\u043D\u0435\u0435 \u043E\u0442\u0440\u0430\u0436\u0430\u0435\u0442 \u0432\u044B\u0440\u0443\u0447\u043A\u0443, \u0437\u0430\u0433\u0440\u0443\u0437\u043A\u0443 \u0438 \u0430\u043A\u0442\u0438\u0432\u043D\u043E\u0441\u0442\u044C \u043A\u043B\u0438\u0435\u043D\u0442\u043E\u0432; \u043F\u043E\u044F\u0441\u043D\u0435\u043D\u0438\u044F \u043A \u043F\u043E\u043A\u0430\u0437\u0430\u0442\u0435\u043B\u044F\u043C \u0441\u0442\u0430\u043B\u0438 \u043F\u043E\u043D\u044F\u0442\u043D\u0435\u0435.",
      "\u0412 \u043A\u043B\u0438\u0435\u043D\u0442\u0441\u043A\u043E\u043C \u043F\u043E\u0440\u0442\u0430\u043B\u0435 \u043F\u043E\u043A\u0430\u0437\u044B\u0432\u0430\u0435\u0442\u0441\u044F \u0431\u043B\u0438\u0436\u0430\u0439\u0448\u0435\u0435 \u0430\u043A\u0442\u0443\u0430\u043B\u044C\u043D\u043E\u0435 \u0437\u0430\u043D\u044F\u0442\u0438\u0435, \u0432\u043A\u043B\u044E\u0447\u0430\u044F \u0443\u0436\u0435 \u043D\u0430\u0447\u0430\u0432\u0448\u0435\u0435\u0441\u044F.",
      "\u041F\u043E\u0434\u043F\u0438\u0441\u043E\u0447\u043D\u044B\u0435 \u043A\u0430\u043B\u0435\u043D\u0434\u0430\u0440\u0438 \u0441\u043E\u0434\u0435\u0440\u0436\u0430\u0442 \u0432\u0441\u044E \u043F\u0440\u043E\u0448\u0435\u0434\u0448\u0443\u044E \u0438\u0441\u0442\u043E\u0440\u0438\u044E \u0438 \u0437\u0430\u043D\u044F\u0442\u0438\u044F \u043D\u0430 \u0431\u043B\u0438\u0436\u0430\u0439\u0448\u0438\u0435 14 \u0434\u043D\u0435\u0439.",
      "\u041E\u0442\u043F\u0443\u0441\u043A\u0430 \u0442\u0435\u043F\u0435\u0440\u044C \u043C\u043E\u0433\u0443\u0442 \u0432\u043A\u043B\u044E\u0447\u0430\u0442\u044C \u0442\u043E\u0447\u043D\u043E\u0435 \u0432\u0440\u0435\u043C\u044F \u043D\u0430\u0447\u0430\u043B\u0430 \u0438 \u043E\u043A\u043E\u043D\u0447\u0430\u043D\u0438\u044F \u0438 \u043E\u0442\u043E\u0431\u0440\u0430\u0436\u0430\u044E\u0442\u0441\u044F \u0432\u043E \u0432\u0441\u0435\u0445 \u0437\u0430\u0442\u0440\u043E\u043D\u0443\u0442\u044B\u0445 \u043D\u0435\u0434\u0435\u043B\u044F\u0445 \u043A\u0430\u043B\u0435\u043D\u0434\u0430\u0440\u044F.",
      "\u0412 \u043A\u0430\u043B\u0435\u043D\u0434\u0430\u0440\u0435 \u043F\u043E\u044F\u0432\u0438\u043B\u0438\u0441\u044C \u043E\u0442\u0434\u0435\u043B\u044C\u043D\u043E\u0435 \u043E\u0444\u043E\u0440\u043C\u043B\u0435\u043D\u0438\u0435 \u043F\u0440\u043E\u0431\u043D\u044B\u0445 \u0437\u0430\u043D\u044F\u0442\u0438\u0439 \u0438 \u0431\u044B\u0441\u0442\u0440\u044B\u0439 \u043F\u0435\u0440\u0435\u0445\u043E\u0434 \u043A \u0441\u043E\u0437\u0434\u0430\u043D\u0438\u044E \u043E\u0442\u043F\u0443\u0441\u043A\u0430 \u0438\u0437 \u0432\u044B\u0431\u0440\u0430\u043D\u043D\u043E\u0433\u043E \u0434\u0438\u0430\u043F\u0430\u0437\u043E\u043D\u0430 \u0432\u0440\u0435\u043C\u0435\u043D\u0438.",
      "\u0412 \u0441\u0442\u0430\u0442\u0438\u0441\u0442\u0438\u043A\u0435 \u0434\u043E\u0445\u043E\u0434\u043E\u0432 \u043F\u043B\u0430\u043D\u043E\u0432\u0430\u044F \u0432\u044B\u0440\u0443\u0447\u043A\u0430 \u0442\u0435\u043F\u0435\u0440\u044C \u043E\u0442\u0434\u0435\u043B\u0435\u043D\u0430 \u043E\u0442 \u0444\u0430\u043A\u0442\u0438\u0447\u0435\u0441\u043A\u043E\u0439 \u0438 \u0440\u0430\u0441\u0441\u0447\u0438\u0442\u044B\u0432\u0430\u0435\u0442\u0441\u044F \u0434\u043B\u044F \u0432\u044B\u0431\u0440\u0430\u043D\u043D\u043E\u0433\u043E \u043F\u0435\u0440\u0438\u043E\u0434\u0430."
    ],
    "fixed": [
      "\u041A\u043B\u0438\u0435\u043D\u0442\u044B, \u0443 \u043A\u043E\u0442\u043E\u0440\u044B\u0445 \u043F\u0440\u043E\u0448\u043B\u0438 \u043F\u043B\u0430\u0442\u043D\u044B\u0435 \u0437\u0430\u043D\u044F\u0442\u0438\u044F \u043F\u043E\u0441\u043B\u0435 \u043A\u043E\u043D\u0441\u0443\u043B\u044C\u0442\u0430\u0446\u0438\u0438, \u0431\u043E\u043B\u044C\u0448\u0435 \u043D\u0435 \u043E\u0441\u0442\u0430\u044E\u0442\u0441\u044F \u0432 \u0441\u0442\u0430\u0442\u0443\u0441\u0435 \u00AB\u0414\u0443\u043C\u0430\u044E\u0449\u0438\u0439 \u043B\u0438\u0434\u00BB.",
      "\u0411\u0443\u0434\u0443\u0449\u0438\u0435 \u043F\u043E\u0432\u0442\u043E\u0440\u044F\u044E\u0449\u0438\u0435\u0441\u044F \u0437\u0430\u043D\u044F\u0442\u0438\u044F \u0431\u043E\u043B\u044C\u0448\u0435 \u043D\u0435 \u0441\u043E\u0437\u0434\u0430\u044E\u0442\u0441\u044F \u043D\u0430 \u0432\u0440\u0435\u043C\u044F \u043E\u0442\u043F\u0443\u0441\u043A\u0430, \u0430 \u043E\u0442\u043C\u0435\u043D\u0430 \u0443\u0436\u0435 \u0437\u0430\u043F\u043B\u0430\u043D\u0438\u0440\u043E\u0432\u0430\u043D\u043D\u044B\u0445 \u0437\u0430\u043D\u044F\u0442\u0438\u0439 \u0442\u0440\u0435\u0431\u0443\u0435\u0442 \u044F\u0432\u043D\u043E\u0433\u043E \u043F\u043E\u0434\u0442\u0432\u0435\u0440\u0436\u0434\u0435\u043D\u0438\u044F."
    ],
    "security": [
      "\u0423\u0441\u0438\u043B\u0435\u043D\u0430 \u0437\u0430\u0449\u0438\u0442\u0430 \u043F\u0430\u0440\u043E\u043B\u0435\u0439 \u0438 \u0441\u0435\u0430\u043D\u0441\u043E\u0432. \u041F\u043E\u0441\u043B\u0435 \u043E\u0431\u043D\u043E\u0432\u043B\u0435\u043D\u0438\u044F \u0430\u043A\u0442\u0438\u0432\u043D\u044B\u0435 \u0441\u0435\u0430\u043D\u0441\u044B \u0431\u0443\u0434\u0443\u0442 \u0437\u0430\u0432\u0435\u0440\u0448\u0435\u043D\u044B, \u0441\u043E\u0442\u0440\u0443\u0434\u043D\u0438\u043A\u0430\u043C \u043F\u043E\u0442\u0440\u0435\u0431\u0443\u0435\u0442\u0441\u044F \u0432\u043E\u0441\u0441\u0442\u0430\u043D\u043E\u0432\u0438\u0442\u044C \u043F\u0430\u0440\u043E\u043B\u0438, \u0430 \u043A\u043B\u0438\u0435\u043D\u0442\u0430\u043C \u2014 \u043F\u043E\u043B\u0443\u0447\u0438\u0442\u044C \u043D\u043E\u0432\u044B\u0435 \u0441\u0441\u044B\u043B\u043A\u0438 \u043D\u0430 \u043F\u043E\u0440\u0442\u0430\u043B.",
      "\u0414\u043E\u0431\u0430\u0432\u043B\u0435\u043D \u0438\u0437\u043E\u043B\u0438\u0440\u043E\u0432\u0430\u043D\u043D\u044B\u0439 \u0430\u0432\u0430\u0440\u0438\u0439\u043D\u044B\u0439 \u0434\u043E\u0441\u0442\u0443\u043F \u0434\u043B\u044F \u0431\u0435\u0437\u043E\u043F\u0430\u0441\u043D\u043E\u0433\u043E \u0432\u043E\u0441\u0441\u0442\u0430\u043D\u043E\u0432\u043B\u0435\u043D\u0438\u044F \u0443\u0447\u0435\u0442\u043D\u044B\u0445 \u0437\u0430\u043F\u0438\u0441\u0435\u0439 \u0438 \u043E\u0442\u0437\u044B\u0432\u0430 \u0441\u0435\u0430\u043D\u0441\u043E\u0432 \u043F\u0440\u0438 \u0441\u0431\u043E\u0435 \u043E\u0431\u044B\u0447\u043D\u043E\u0433\u043E \u0432\u0445\u043E\u0434\u0430."
    ]
  }
}
