{
  "version": "2026.07.2",
  "codename": "Barrè",
  "codenameMeaning": "Приём игры на гитаре, при котором одним пальцем зажимают несколько струн на одном ладу.",
  "date": "2026-07-30",
  "changes": {
    "new": [],
    "improved": [
      "Переработка и упрощение статистики",
      "Копирование кодов восстановления, секрета двухфакторной защиты и подготовленного расписания стало надёжнее в мобильных браузерах."
    ],
    "fixed": [
      "Повторяющиеся задачи снова можно выполнять, переносить и отменять без ошибки."
    ],
    "security": [
      "История обновлений теперь доступна только администраторам и суперпользователям."
    ]
  }
}
